{"$schema":"https://json-schema.org/draft/2020-12/schema","additionalProperties":false,"type":"object","required":["schema_version","canonicalization_version","queue_id","queue_revision","legacy_queue_ref","active_work_package_id","ready_work_packages","blocked_work_packages","policy"],"properties":{"schema_version":{"const":1},"canonicalization_version":{"const":1},"queue_id":{"type":"string","minLength":3},"queue_revision":{"type":"integer","minimum":1},"legacy_queue_ref":{"type":"string","minLength":1},"active_work_package_id":{"type":["string","null"]},"ready_work_packages":{"type":"array","uniqueItems":true,"maxItems":5,"items":{"type":"string","pattern":"^KB-WP-[0-9]{3}$"}},"blocked_work_packages":{"type":"array","uniqueItems":true,"items":{"type":"string","pattern":"^KB-WP-[0-9]{3}$"}},"policy":{"type":"object","required":["ordering","fixed_ordinal_refresh","queue_depth_is_not_a_completion_metric"]}}}
