{"schema_version":1,"canonicalization_version":1,"queue_id":"elementor-v4-work-packages","queue_revision":1,"legacy_queue_ref":"planning/ROLLING_QUEUE.json","active_work_package_id":null,"ready_work_packages":["KB-WP-001","KB-WP-002","KB-WP-003"],"blocked_work_packages":[],"policy":{"ordering":"priority_and_value","fixed_ordinal_refresh":false,"queue_depth_is_not_a_completion_metric":true}}